[
  {
    "Domain": "DAT",
    "Config_Set": "DAT_FIELD_STATUS_CONTROL",
    "Priority": "P0",
    "Scope": "TENANT",
    "Purpose": "Required/optional/hidden/read-only fields by doc type and state.",
    "Minimum_Requirements_(P0)": "Rules by resource+doc type+state; conditional requirements; API enforcement.",
    "Key_Attributes_(suggested)": "resource, field, doc_type, state, effect, condition",
    "Standards/Reference": "ERP practice",
    "Recommended_Data_Model": "Policy/rules",
    "Effective-Dated?": "Yes",
    "Typical_Values_Count_(P0)": "200-20000",
    "SAP_S4HANA": "PASS",
    "Oracle_NetSuite": "PARTIAL",
    "MS_Dynamics_365": "PASS",
    "Odoo": "PARTIAL",
    "Zoho": "WEAK",
    "QuickBooks": "WEAK",
    "Evidence_Level": "INFERRED",
    "Evidence_URLs": "",
    "Notes_for_Migration/Extensibility": "Huge for migrations: mirror legacy “required fields” quickly."
  },
  {
    "Domain": "DAT",
    "Config_Set": "DAT_STATUS_LIFECYCLE",
    "Priority": "P0",
    "Scope": "TENANT",
    "Purpose": "Reusable lifecycle definitions (draft/active/blocked/obsolete).",
    "Minimum_Requirements_(P0)": "State list; transitions; invariants; terminal states.",
    "Key_Attributes_(suggested)": "lifecycle_code, states, transitions, invariants",
    "Standards/Reference": "ERP practice",
    "Recommended_Data_Model": "Value-set + graph",
    "Effective-Dated?": "Yes",
    "Typical_Values_Count_(P0)": "10-200",
    "SAP_S4HANA": "PASS",
    "Oracle_NetSuite": "PASS",
    "MS_Dynamics_365": "PASS",
    "Odoo": "PASS",
    "Zoho": "PARTIAL",
    "QuickBooks": "WEAK",
    "Evidence_Level": "INFERRED",
    "Evidence_URLs": "",
    "Notes_for_Migration/Extensibility": "Avoid hardcoding states per canon."
  },
  {
    "Domain": "DAT",
    "Config_Set": "DAT_AUDIT_LEVEL",
    "Priority": "P1",
    "Scope": "TENANT",
    "Purpose": "Audit verbosity per module/resource.",
    "Minimum_Requirements_(P0)": "Levels; rules for what to capture; retention binding.",
    "Key_Attributes_(suggested)": "level_code, capture_rules, retention_ref",
    "Standards/Reference": "Audit practice",
    "Recommended_Data_Model": "Policy",
    "Effective-Dated?": "Yes",
    "Typical_Values_Count_(P0)": "5-30",
    "SAP_S4HANA": "PASS",
    "Oracle_NetSuite": "PARTIAL",
    "MS_Dynamics_365": "PASS",
    "Odoo": "PARTIAL",
    "Zoho": "WEAK",
    "QuickBooks": "WEAK",
    "Evidence_Level": "INFERRED",
    "Evidence_URLs": "",
    "Notes_for_Migration/Extensibility": "Lets enterprises tune audit posture without redeploy."
  },
  {
    "Domain": "DAT",
    "Config_Set": "DAT_CHANGE_REASON_CODE",
    "Priority": "P1",
    "Scope": "TENANT",
    "Purpose": "Reason codes required for sensitive changes.",
    "Minimum_Requirements_(P0)": "Reason code list; category; requires comment; applies-to.",
    "Key_Attributes_(suggested)": "reason_code, category, requires_comment, applies_to",
    "Standards/Reference": "Audit practice",
    "Recommended_Data_Model": "Value-set",
    "Effective-Dated?": "No",
    "Typical_Values_Count_(P0)": "20-200",
    "SAP_S4HANA": "PASS",
    "Oracle_NetSuite": "PARTIAL",
    "MS_Dynamics_365": "PASS",
    "Odoo": "PARTIAL",
    "Zoho": "WEAK",
    "QuickBooks": "WEAK",
    "Evidence_Level": "INFERRED",
    "Evidence_URLs": "",
    "Notes_for_Migration/Extensibility": "Improves audit quality and investigations."
  },
  {
    "Domain": "DAT",
    "Config_Set": "DAT_DATA_CLASSIFICATION",
    "Priority": "P1",
    "Scope": "TENANT",
    "Purpose": "PII/PCI/confidential classification labels and handling rules.",
    "Minimum_Requirements_(P0)": "Classification levels; retention; masking/export restrictions.",
    "Key_Attributes_(suggested)": "class_code, handling_rules, masking_rules, retention_ref",
    "Standards/Reference": "Privacy/security practice",
    "Recommended_Data_Model": "Policy/value-set",
    "Effective-Dated?": "Yes",
    "Typical_Values_Count_(P0)": "5-50",
    "SAP_S4HANA": "PASS",
    "Oracle_NetSuite": "PARTIAL",
    "MS_Dynamics_365": "PASS",
    "Odoo": "PARTIAL",
    "Zoho": "WEAK",
    "QuickBooks": "WEAK",
    "Evidence_Level": "INFERRED",
    "Evidence_URLs": "",
    "Notes_for_Migration/Extensibility": "Required to align IAM field policies with privacy posture."
  },
  {
    "Domain": "DAT",
    "Config_Set": "DAT_TRANSLATION_DICTIONARY",
    "Priority": "P1",
    "Scope": "TENANT",
    "Purpose": "Translations for labels and master data descriptions.",
    "Minimum_Requirements_(P0)": "Keyed strings; locale variants; fallback; versioning.",
    "Key_Attributes_(suggested)": "key, locale, text, context, version",
    "Standards/Reference": "i18n practice",
    "Recommended_Data_Model": "Entity",
    "Effective-Dated?": "Yes",
    "Typical_Values_Count_(P0)": "1000-500000",
    "SAP_S4HANA": "PASS",
    "Oracle_NetSuite": "PASS",
    "MS_Dynamics_365": "PASS",
    "Odoo": "PASS",
    "Zoho": "PASS",
    "QuickBooks": "PARTIAL",
    "Evidence_Level": "INFERRED",
    "Evidence_URLs": "",
    "Notes_for_Migration/Extensibility": "Never translate codes; translate display names only."
  }
]