[
  {
    "Domain": "CODE",
    "Config_Set": "CODE_BANK_ACCOUNT_IBAN_POLICY",
    "Priority": "P1",
    "Scope": "TENANT",
    "Purpose": "IBAN validation and storage rules.",
    "Minimum_Requirements_(P0)": "Validate IBAN structure per country; checksum validation; store normalized.",
    "Key_Attributes_(suggested)": "enabled, country_formats, checksum, normalization_rules",
    "Standards/Reference": "ISO 13616 (IBAN)",
    "Recommended_Data_Model": "Policy",
    "Effective-Dated?": "No",
    "Typical_Values_Count_(P0)": "1-260",
    "SAP_S4HANA": "PASS",
    "Oracle_NetSuite": "PASS",
    "MS_Dynamics_365": "PASS",
    "Odoo": "PARTIAL",
    "Zoho": "PARTIAL",
    "QuickBooks": "WEAK",
    "Evidence_Level": "DOC",
    "Evidence_URLs": "https://www.swift.com/standards/data-standards/iban-international-bank-account-number",
    "Notes_for_Migration/Extensibility": "Keep country-format registry pluggable; validation rules change."
  },
  {
    "Domain": "CODE",
    "Config_Set": "CODE_BANK_IDENTIFIER_BIC",
    "Priority": "P1",
    "Scope": "TENANT",
    "Purpose": "BIC/SWIFT identifier storage and validation.",
    "Minimum_Requirements_(P0)": "Store BIC (8 or 11 chars); validate format; bind to bank master records.",
    "Key_Attributes_(suggested)": "bic, institution_name, country, city, branch, status",
    "Standards/Reference": "ISO 9362 (BIC)",
    "Recommended_Data_Model": "Value-set / entity",
    "Effective-Dated?": "Yes",
    "Typical_Values_Count_(P0)": "100-50000",
    "SAP_S4HANA": "PASS",
    "Oracle_NetSuite": "PASS",
    "MS_Dynamics_365": "PASS",
    "Odoo": "PARTIAL",
    "Zoho": "PARTIAL",
    "QuickBooks": "WEAK",
    "Evidence_Level": "DOC",
    "Evidence_URLs": "https://www.swift.com/standards/data-standards/bic-business-identifier-code",
    "Notes_for_Migration/Extensibility": "Treat as reference data; allow lookups and imports from registries."
  },
  {
    "Domain": "CODE",
    "Config_Set": "CODE_INCOTERMS",
    "Priority": "P1",
    "Scope": "TENANT",
    "Purpose": "Incoterms trade terms used on sales/purchase documents.",
    "Minimum_Requirements_(P0)": "Maintain 11 Incoterms codes; version tagging (Incoterms 2020 vs 2010); default per customer/vendor.",
    "Key_Attributes_(suggested)": "code, version, description, allowed_docs, default_rules",
    "Standards/Reference": "ICC IncotermsÂ® rules",
    "Recommended_Data_Model": "Value-set",
    "Effective-Dated?": "Yes",
    "Typical_Values_Count_(P0)": "11-22",
    "SAP_S4HANA": "PASS",
    "Oracle_NetSuite": "PASS",
    "MS_Dynamics_365": "PASS",
    "Odoo": "PARTIAL",
    "Zoho": "WEAK",
    "QuickBooks": "",
    "Evidence_Level": "DOC",
    "Evidence_URLs": "https://iccwbo.org/business-solutions/incoterms-rules/",
    "Notes_for_Migration/Extensibility": "Store both code and version; migrations often need to preserve the historical version."
  },
  {
    "Domain": "CODE",
    "Config_Set": "CODE_PHONE_E164_POLICY",
    "Priority": "P1",
    "Scope": "TENANT",
    "Purpose": "Phone number normalization/validation policy.",
    "Minimum_Requirements_(P0)": "Store phone numbers in E.164 for APIs; keep display formatting; enforce max length; validation.",
    "Key_Attributes_(suggested)": "default_country_code, validation_mode, storage_format, display_format",
    "Standards/Reference": "ITU-T E.164",
    "Recommended_Data_Model": "Policy",
    "Effective-Dated?": "No",
    "Typical_Values_Count_(P0)": "1-10",
    "SAP_S4HANA": "PASS",
    "Oracle_NetSuite": "PASS",
    "MS_Dynamics_365": "PASS",
    "Odoo": "PARTIAL",
    "Zoho": "PARTIAL",
    "QuickBooks": "PARTIAL",
    "Evidence_Level": "DOC",
    "Evidence_URLs": "https://www.itu.int/rec/T-REC-E.164/",
    "Notes_for_Migration/Extensibility": "Normalize on ingest; keep raw input for audit/debug."
  }
]