[
  {
    "Domain": "INT",
    "Config_Set": "INT_EXTERNAL_ID_POLICY",
    "Priority": "P0",
    "Scope": "TENANT",
    "Purpose": "External ID namespaces and uniqueness rules.",
    "Minimum_Requirements_(P0)": "Namespace per system; uniqueness scope; lock-after-bind rules.",
    "Key_Attributes_(suggested)": "system_ref, namespace, uniqueness_scope, lock_after_bind",
    "Standards/Reference": "Integration practice",
    "Recommended_Data_Model": "Policy",
    "Effective-Dated?": "Yes",
    "Typical_Values_Count_(P0)": "5-100",
    "SAP_S4HANA": "PASS",
    "Oracle_NetSuite": "PASS",
    "MS_Dynamics_365": "PASS",
    "Odoo": "PASS",
    "Zoho": "PARTIAL",
    "QuickBooks": "PARTIAL",
    "Evidence_Level": "INFERRED",
    "Evidence_URLs": "",
    "Notes_for_Migration/Extensibility": "Critical for migrations and bidirectional sync."
  },
  {
    "Domain": "INT",
    "Config_Set": "INT_IDEMPOTENCY_POLICY",
    "Priority": "P0",
    "Scope": "TENANT",
    "Purpose": "Idempotency keys for APIs/imports.",
    "Minimum_Requirements_(P0)": "Key fields; time window; conflict response; replay behavior.",
    "Key_Attributes_(suggested)": "resource, key_fields, window, conflict_mode, replay_rules",
    "Standards/Reference": "API practice",
    "Recommended_Data_Model": "Policy",
    "Effective-Dated?": "Yes",
    "Typical_Values_Count_(P0)": "10-200",
    "SAP_S4HANA": "PASS",
    "Oracle_NetSuite": "PARTIAL",
    "MS_Dynamics_365": "PASS",
    "Odoo": "PARTIAL",
    "Zoho": "WEAK",
    "QuickBooks": "WEAK",
    "Evidence_Level": "INFERRED",
    "Evidence_URLs": "",
    "Notes_for_Migration/Extensibility": "Prevents duplicate documents during retries."
  },
  {
    "Domain": "INT",
    "Config_Set": "INT_ID_MAPPING",
    "Priority": "P0",
    "Scope": "TENANT",
    "Purpose": "Mapping table for internal IDs to external IDs (many-to-many when needed).",
    "Minimum_Requirements_(P0)": "Mapping entries; conflict rules; versioning; historical mappings.",
    "Key_Attributes_(suggested)": "system_ref, object_type, internal_id, external_id, effective_from/to",
    "Standards/Reference": "Integration practice",
    "Recommended_Data_Model": "Entity",
    "Effective-Dated?": "Yes",
    "Typical_Values_Count_(P0)": "100-1000000",
    "SAP_S4HANA": "PASS",
    "Oracle_NetSuite": "PASS",
    "MS_Dynamics_365": "PASS",
    "Odoo": "PASS",
    "Zoho": "PARTIAL",
    "QuickBooks": "PARTIAL",
    "Evidence_Level": "INFERRED",
    "Evidence_URLs": "",
    "Notes_for_Migration/Extensibility": "Keep mapping effective-dated to support rekeys and cutover."
  },
  {
    "Domain": "INT",
    "Config_Set": "INT_SYSTEM_REGISTRY",
    "Priority": "P0",
    "Scope": "TENANT",
    "Purpose": "Registry of connected systems and endpoints.",
    "Minimum_Requirements_(P0)": "System codes; endpoints; auth refs; environments; owners.",
    "Key_Attributes_(suggested)": "system_code, type, base_url, auth_ref, env, owner",
    "Standards/Reference": "Integration practice",
    "Recommended_Data_Model": "Entity",
    "Effective-Dated?": "Yes",
    "Typical_Values_Count_(P0)": "5-500",
    "SAP_S4HANA": "PASS",
    "Oracle_NetSuite": "PASS",
    "MS_Dynamics_365": "PASS",
    "Odoo": "PASS",
    "Zoho": "PARTIAL",
    "QuickBooks": "PARTIAL",
    "Evidence_Level": "INFERRED",
    "Evidence_URLs": "",
    "Notes_for_Migration/Extensibility": "Needed for provenance and stable external ID namespaces."
  },
  {
    "Domain": "INT",
    "Config_Set": "INT_RETRY_POLICY",
    "Priority": "P1",
    "Scope": "TENANT",
    "Purpose": "Retry/backoff/DLQ for integrations and jobs.",
    "Minimum_Requirements_(P0)": "Backoff strategy; max retries; DLQ route; alerts.",
    "Key_Attributes_(suggested)": "policy_code, backoff, max_retries, dlq, alerts",
    "Standards/Reference": "Reliability engineering practice",
    "Recommended_Data_Model": "Policy",
    "Effective-Dated?": "Yes",
    "Typical_Values_Count_(P0)": "5-100",
    "SAP_S4HANA": "PASS",
    "Oracle_NetSuite": "PASS",
    "MS_Dynamics_365": "PASS",
    "Odoo": "PARTIAL",
    "Zoho": "WEAK",
    "QuickBooks": "WEAK",
    "Evidence_Level": "INFERRED",
    "Evidence_URLs": "",
    "Notes_for_Migration/Extensibility": "Make per-connector/per-tenant; keep safe defaults."
  },
  {
    "Domain": "INT",
    "Config_Set": "INT_WEBHOOK_SUBSCRIPTION",
    "Priority": "P1",
    "Scope": "TENANT",
    "Purpose": "Outbound webhook registration and signing.",
    "Minimum_Requirements_(P0)": "Events; target URL; signing secrets; retry policy; filtering.",
    "Key_Attributes_(suggested)": "event_types, target_url, signing, retry_policy, filters",
    "Standards/Reference": "Webhook practice",
    "Recommended_Data_Model": "Entity",
    "Effective-Dated?": "Yes",
    "Typical_Values_Count_(P0)": "5-5000",
    "SAP_S4HANA": "PASS",
    "Oracle_NetSuite": "PASS",
    "MS_Dynamics_365": "PASS",
    "Odoo": "PARTIAL",
    "Zoho": "PARTIAL",
    "QuickBooks": "WEAK",
    "Evidence_Level": "INFERRED",
    "Evidence_URLs": "",
    "Notes_for_Migration/Extensibility": "Helps customers integrate without polling."
  }
]