[
  {
    "Domain": "LOC",
    "Config_Set": "LOC_COUNTRY_CODE",
    "Priority": "P0",
    "Scope": "GLOBAL",
    "Purpose": "Country codes for address/tax/localization routing.",
    "Minimum_Requirements_(P0)": "ISO country list; active flags; region groupings.",
    "Key_Attributes_(suggested)": "country_code, name, region_group, status",
    "Standards/Reference": "ISO 3166-1",
    "Recommended_Data_Model": "Value-set",
    "Effective-Dated?": "No",
    "Typical_Values_Count_(P0)": "200-260",
    "SAP_S4HANA": "PASS",
    "Oracle_NetSuite": "PASS",
    "MS_Dynamics_365": "PASS",
    "Odoo": "PASS",
    "Zoho": "PASS",
    "QuickBooks": "PASS",
    "Evidence_Level": "INFERRED",
    "Evidence_URLs": "",
    "Notes_for_Migration/Extensibility": "Keep stable codes; allow aliases for legacy systems."
  },
  {
    "Domain": "LOC",
    "Config_Set": "LOC_ADDRESS_FORMAT_PROFILE",
    "Priority": "P1",
    "Scope": "TENANT",
    "Purpose": "Country-specific address formatting and validation rules.",
    "Minimum_Requirements_(P0)": "Required fields; ordering; postal code patterns; script rules.",
    "Key_Attributes_(suggested)": "country_ref, required_fields, ordering, regex_patterns",
    "Standards/Reference": "Postal/address practice (varies)",
    "Recommended_Data_Model": "Policy",
    "Effective-Dated?": "Yes",
    "Typical_Values_Count_(P0)": "10-260",
    "SAP_S4HANA": "PASS",
    "Oracle_NetSuite": "PASS",
    "MS_Dynamics_365": "PASS",
    "Odoo": "PARTIAL",
    "Zoho": "PARTIAL",
    "QuickBooks": "WEAK",
    "Evidence_Level": "INFERRED",
    "Evidence_URLs": "",
    "Notes_for_Migration/Extensibility": "Helps migration cleanup and standardized printing."
  },
  {
    "Domain": "LOC",
    "Config_Set": "LOC_GDPR_PRIVACY_POLICY",
    "Priority": "P1",
    "Scope": "TENANT",
    "Purpose": "Privacy controls (retention, erasure, DSAR export).",
    "Minimum_Requirements_(P0)": "Retention by classification; deletion/anonymization rules; access logging.",
    "Key_Attributes_(suggested)": "data_class, retention, erasure_mode, dsar_export, logging",
    "Standards/Reference": "GDPR and similar privacy laws",
    "Recommended_Data_Model": "Policy",
    "Effective-Dated?": "Yes",
    "Typical_Values_Count_(P0)": "5-100",
    "SAP_S4HANA": "PASS",
    "Oracle_NetSuite": "PARTIAL",
    "MS_Dynamics_365": "PASS",
    "Odoo": "PARTIAL",
    "Zoho": "WEAK",
    "QuickBooks": "WEAK",
    "Evidence_Level": "INFERRED",
    "Evidence_URLs": "",
    "Notes_for_Migration/Extensibility": "Even non-EU enterprises ask for privacy posture."
  },
  {
    "Domain": "LOC",
    "Config_Set": "LOC_LANGUAGE_CODE",
    "Priority": "P1",
    "Scope": "GLOBAL",
    "Purpose": "Language codes used in locale/translation.",
    "Minimum_Requirements_(P0)": "Language list; active flags.",
    "Key_Attributes_(suggested)": "lang_code, name, status",
    "Standards/Reference": "ISO 639 (reference)",
    "Recommended_Data_Model": "Value-set",
    "Effective-Dated?": "No",
    "Typical_Values_Count_(P0)": "50-200",
    "SAP_S4HANA": "PASS",
    "Oracle_NetSuite": "PASS",
    "MS_Dynamics_365": "PASS",
    "Odoo": "PASS",
    "Zoho": "PASS",
    "QuickBooks": "PASS",
    "Evidence_Level": "INFERRED",
    "Evidence_URLs": "",
    "Notes_for_Migration/Extensibility": "Keep separate from locale tags (which combine language + region)."
  },
  {
    "Domain": "LOC",
    "Config_Set": "LOC_EINVOICE_SCHEMA",
    "Priority": "P2",
    "Scope": "TENANT",
    "Purpose": "E-invoice schema registry (PEPPOL / country frameworks).",
    "Minimum_Requirements_(P0)": "Schema code; version; validation; endpoints; required fields.",
    "Key_Attributes_(suggested)": "schema_code, version, jurisdiction, validator, endpoints",
    "Standards/Reference": "Jurisdictional e-invoice frameworks",
    "Recommended_Data_Model": "Registry + rules",
    "Effective-Dated?": "Yes",
    "Typical_Values_Count_(P0)": "0-100",
    "SAP_S4HANA": "PASS",
    "Oracle_NetSuite": "PARTIAL",
    "MS_Dynamics_365": "PASS",
    "Odoo": "PARTIAL",
    "Zoho": "WEAK",
    "QuickBooks": "WEAK",
    "Evidence_Level": "INFERRED",
    "Evidence_URLs": "",
    "Notes_for_Migration/Extensibility": "Make pluggable."
  }
]