[
  {
    "Domain": "WF",
    "Config_Set": "WF_APPROVAL_POLICY",
    "Priority": "P0",
    "Scope": "TENANT",
    "Purpose": "Approval policies (who must approve what).",
    "Minimum_Requirements_(P0)": "Multi-level approvals; amount thresholds; conditional routing; audit trail; override rules.",
    "Key_Attributes_(suggested)": "policy_id, applies_to(resource/doc_type), thresholds, approver_roles, escalation_ref, effective_from/to",
    "Standards/Reference": "COSO/SOX concepts (contextual)",
    "Recommended_Data_Model": "Rules/policy engine",
    "Effective-Dated?": "Yes",
    "Typical_Values_Count_(P0)": "20-2000",
    "SAP_S4HANA": "PASS",
    "Oracle_NetSuite": "PASS",
    "MS_Dynamics_365": "PASS",
    "Odoo": "PARTIAL",
    "Zoho": "WEAK",
    "QuickBooks": "WEAK",
    "Evidence_Level": "INFERRED",
    "Evidence_URLs": "",
    "Notes_for_Migration/Extensibility": "Make policies data-driven; avoid hardcoding per module."
  },
  {
    "Domain": "WF",
    "Config_Set": "WF_ESCALATION_RULE",
    "Priority": "P1",
    "Scope": "TENANT",
    "Purpose": "Escalation and timeout behavior for approvals.",
    "Minimum_Requirements_(P0)": "Escalate after N hours/days; notify; reassign; fallback approvers.",
    "Key_Attributes_(suggested)": "rule_id, timeout, escalation_path, notify_channels, business_hours_ref",
    "Standards/Reference": "Ops/controls practice",
    "Recommended_Data_Model": "Policy",
    "Effective-Dated?": "Yes",
    "Typical_Values_Count_(P0)": "10-500",
    "SAP_S4HANA": "PASS",
    "Oracle_NetSuite": "PASS",
    "MS_Dynamics_365": "PASS",
    "Odoo": "PARTIAL",
    "Zoho": "WEAK",
    "QuickBooks": "WEAK",
    "Evidence_Level": "INFERRED",
    "Evidence_URLs": "",
    "Notes_for_Migration/Extensibility": "Tie to working-day calendar to avoid escalating over weekends/holidays."
  },
  {
    "Domain": "WF",
    "Config_Set": "WF_WORKFLOW_TEMPLATE",
    "Priority": "P1",
    "Scope": "TENANT",
    "Purpose": "Reusable workflow templates (state machine + actions).",
    "Minimum_Requirements_(P0)": "Define states, transitions, guards, actions; per doc type bindings.",
    "Key_Attributes_(suggested)": "template_code, states, transitions, guards, actions, bindings",
    "Standards/Reference": "State machine practice",
    "Recommended_Data_Model": "Graph + rules",
    "Effective-Dated?": "Yes",
    "Typical_Values_Count_(P0)": "10-200",
    "SAP_S4HANA": "PASS",
    "Oracle_NetSuite": "PARTIAL",
    "MS_Dynamics_365": "PASS",
    "Odoo": "PARTIAL",
    "Zoho": "WEAK",
    "QuickBooks": "WEAK",
    "Evidence_Level": "INFERRED",
    "Evidence_URLs": "",
    "Notes_for_Migration/Extensibility": "Use declarative state machines so modules inherit workflow capabilities."
  }
]