[
  {
    "Domain": "DOC",
    "Config_Set": "DOC_DOCUMENT_TYPE",
    "Priority": "P0",
    "Scope": "TENANT",
    "Purpose": "Canonical document types used across ERP.",
    "Minimum_Requirements_(P0)": "Doc codes; module binding; posting behavior; lifecycle; numbering link.",
    "Key_Attributes_(suggested)": "doc_type, module, posting_behavior, lifecycle_ref, sequence_ref",
    "Standards/Reference": "ERP practice",
    "Recommended_Data_Model": "Value-set",
    "Effective-Dated?": "Yes",
    "Typical_Values_Count_(P0)": "50-300",
    "SAP_S4HANA": "PASS",
    "Oracle_NetSuite": "PASS",
    "MS_Dynamics_365": "PASS",
    "Odoo": "PASS",
    "Zoho": "PARTIAL",
    "QuickBooks": "PARTIAL",
    "Evidence_Level": "INFERRED",
    "Evidence_URLs": "",
    "Notes_for_Migration/Extensibility": "Doc types are the glue for numbering, approvals, and field-status control."
  },
  {
    "Domain": "DOC",
    "Config_Set": "DOC_NUMBER_SEQUENCE",
    "Priority": "P0",
    "Scope": "TENANT",
    "Purpose": "Unique numbering generator for documents/master records.",
    "Minimum_Requirements_(P0)": "Pattern; scope (tenant/entity/site); shared/per-entity; collision handling.",
    "Key_Attributes_(suggested)": "seq_code, pattern, scope, start, end, next, padding, prefix",
    "Standards/Reference": "ERP practice",
    "Recommended_Data_Model": "Entity + generator",
    "Effective-Dated?": "Yes",
    "Typical_Values_Count_(P0)": "50-2000",
    "SAP_S4HANA": "PASS",
    "Oracle_NetSuite": "PASS",
    "MS_Dynamics_365": "PASS",
    "Odoo": "PARTIAL",
    "Zoho": "PARTIAL",
    "QuickBooks": "PARTIAL",
    "Evidence_Level": "DOC",
    "Evidence_URLs": "https://learn.microsoft.com/en-us/dynamics365/fin-ops-core/fin-ops/organization-administration/number-sequence-overview",
    "Notes_for_Migration/Extensibility": "Model scope + reset policies from day one to match legacy systems."
  },
  {
    "Domain": "DOC",
    "Config_Set": "DOC_ATTACHMENT_POLICY",
    "Priority": "P1",
    "Scope": "TENANT",
    "Purpose": "Attachment requirements and retention.",
    "Minimum_Requirements_(P0)": "Required attachments by doc type; storage profile; retention; access.",
    "Key_Attributes_(suggested)": "doc_type, required, storage_profile, retention, access_policy",
    "Standards/Reference": "Security/compliance practice",
    "Recommended_Data_Model": "Policy",
    "Effective-Dated?": "Yes",
    "Typical_Values_Count_(P0)": "20-500",
    "SAP_S4HANA": "PASS",
    "Oracle_NetSuite": "PASS",
    "MS_Dynamics_365": "PASS",
    "Odoo": "PARTIAL",
    "Zoho": "PARTIAL",
    "QuickBooks": "WEAK",
    "Evidence_Level": "INFERRED",
    "Evidence_URLs": "",
    "Notes_for_Migration/Extensibility": "AP and compliance-heavy customers depend on this."
  },
  {
    "Domain": "DOC",
    "Config_Set": "DOC_GAPLESS_NUMBERING_POLICY",
    "Priority": "P1",
    "Scope": "TENANT",
    "Purpose": "Gapless sequences where required by law.",
    "Minimum_Requirements_(P0)": "Reservation strategy; void handling; audit; strict posting integration.",
    "Key_Attributes_(suggested)": "seq_ref, gapless, reservation, void_policy, audit_level",
    "Standards/Reference": "Jurisdictional invoicing rules (varies)",
    "Recommended_Data_Model": "Policy",
    "Effective-Dated?": "Yes",
    "Typical_Values_Count_(P0)": "0-200",
    "SAP_S4HANA": "PASS",
    "Oracle_NetSuite": "PARTIAL",
    "MS_Dynamics_365": "PASS",
    "Odoo": "WEAK",
    "Zoho": "WEAK",
    "QuickBooks": "WEAK",
    "Evidence_Level": "INFERRED",
    "Evidence_URLs": "",
    "Notes_for_Migration/Extensibility": "Implement as opt-in policy. It’s hard to add later."
  },
  {
    "Domain": "DOC",
    "Config_Set": "DOC_NUMBER_RESET_POLICY",
    "Priority": "P1",
    "Scope": "TENANT",
    "Purpose": "Defines when number sequences reset.",
    "Minimum_Requirements_(P0)": "Never/yearly/monthly/per period; fiscal-calendar binding; lock on close.",
    "Key_Attributes_(suggested)": "seq_ref, cadence, fiscal_calendar_ref, lock_on_close",
    "Standards/Reference": "ERP practice",
    "Recommended_Data_Model": "Policy",
    "Effective-Dated?": "Yes",
    "Typical_Values_Count_(P0)": "10-2000",
    "SAP_S4HANA": "PASS",
    "Oracle_NetSuite": "PASS",
    "MS_Dynamics_365": "PASS",
    "Odoo": "PARTIAL",
    "Zoho": "WEAK",
    "QuickBooks": "WEAK",
    "Evidence_Level": "INFERRED",
    "Evidence_URLs": "",
    "Notes_for_Migration/Extensibility": "Needed for jurisdictions requiring yearly invoice numbering."
  },
  {
    "Domain": "DOC",
    "Config_Set": "DOC_REVISION_POLICY",
    "Priority": "P1",
    "Scope": "TENANT",
    "Purpose": "Revisioning and amendment handling for controlled documents.",
    "Minimum_Requirements_(P0)": "Revision scheme; immutable states; amendment doc types.",
    "Key_Attributes_(suggested)": "policy_code, revision_format, immutable_states, amendment_doc_type",
    "Standards/Reference": "Audit/controls practice",
    "Recommended_Data_Model": "Policy",
    "Effective-Dated?": "Yes",
    "Typical_Values_Count_(P0)": "5-100",
    "SAP_S4HANA": "PASS",
    "Oracle_NetSuite": "PASS",
    "MS_Dynamics_365": "PASS",
    "Odoo": "PARTIAL",
    "Zoho": "PARTIAL",
    "QuickBooks": "WEAK",
    "Evidence_Level": "INFERRED",
    "Evidence_URLs": "",
    "Notes_for_Migration/Extensibility": "Needed for BOM, contracts, and posted invoices."
  },
  {
    "Domain": "DOC",
    "Config_Set": "DOC_EINVOICE_SCHEMA",
    "Priority": "P2",
    "Scope": "TENANT",
    "Purpose": "E-invoice schema registry per jurisdiction.",
    "Minimum_Requirements_(P0)": "Schema code; version; validation rules; required fields; endpoints.",
    "Key_Attributes_(suggested)": "schema_code, version, jurisdiction, validator, endpoints",
    "Standards/Reference": "Jurisdictional e-invoice frameworks",
    "Recommended_Data_Model": "Registry + rules",
    "Effective-Dated?": "Yes",
    "Typical_Values_Count_(P0)": "0-100",
    "SAP_S4HANA": "PASS",
    "Oracle_NetSuite": "PARTIAL",
    "MS_Dynamics_365": "PASS",
    "Odoo": "PARTIAL",
    "Zoho": "WEAK",
    "QuickBooks": "WEAK",
    "Evidence_Level": "INFERRED",
    "Evidence_URLs": "",
    "Notes_for_Migration/Extensibility": "Make pluggable so new countries don’t require refactors."
  },
  {
    "Domain": "DOC",
    "Config_Set": "DOC_PRINT_TEMPLATE",
    "Priority": "P2",
    "Scope": "TENANT",
    "Purpose": "Print/PDF templates for documents (invoice, PO, etc.).",
    "Minimum_Requirements_(P0)": "Template per doc type; locale variants; versioning; tenant overrides.",
    "Key_Attributes_(suggested)": "template_code, doc_type, locale, version, content_ref, status",
    "Standards/Reference": "Document generation practice",
    "Recommended_Data_Model": "Entity + template store",
    "Effective-Dated?": "Yes",
    "Typical_Values_Count_(P0)": "10-2000",
    "SAP_S4HANA": "PASS",
    "Oracle_NetSuite": "PASS",
    "MS_Dynamics_365": "PASS",
    "Odoo": "PASS",
    "Zoho": "PARTIAL",
    "QuickBooks": "PARTIAL",
    "Evidence_Level": "INFERRED",
    "Evidence_URLs": "",
    "Notes_for_Migration/Extensibility": "Separate layout templates from business logic; enable per-tenant customization."
  }
]