[
  {
    "Domain": "MAT",
    "Config_Set": "MAT_UOM",
    "Priority": "P0",
    "Scope": "TENANT",
    "Purpose": "Unit-of-measure master list.",
    "Minimum_Requirements_(P0)": "UNECE codes; symbols; active flags; category binding.",
    "Key_Attributes_(suggested)": "uom_code, unece_code, symbol, name, category",
    "Standards/Reference": "UNECE Rec 20",
    "Recommended_Data_Model": "Value-set",
    "Effective-Dated?": "No",
    "Typical_Values_Count_(P0)": "50-500",
    "SAP_S4HANA": "PASS",
    "Oracle_NetSuite": "PASS",
    "MS_Dynamics_365": "PASS",
    "Odoo": "PASS",
    "Zoho": "PARTIAL",
    "QuickBooks": "PARTIAL",
    "Evidence_Level": "DOC",
    "Evidence_URLs": "https://unece.org/trade/documents/2021/06/uncefact-rec20-0",
    "Notes_for_Migration/Extensibility": "Store UNECE code even if you use internal codes."
  },
  {
    "Domain": "MAT",
    "Config_Set": "MAT_UOM_CATEGORY",
    "Priority": "P0",
    "Scope": "TENANT",
    "Purpose": "UOM categories (mass/length/volume/count).",
    "Minimum_Requirements_(P0)": "Category list; base UOM per category; allowed conversions.",
    "Key_Attributes_(suggested)": "category_code, base_uom, dimension_type",
    "Standards/Reference": "UNECE Rec 20",
    "Recommended_Data_Model": "Value-set",
    "Effective-Dated?": "No",
    "Typical_Values_Count_(P0)": "10-50",
    "SAP_S4HANA": "PASS",
    "Oracle_NetSuite": "PASS",
    "MS_Dynamics_365": "PASS",
    "Odoo": "PASS",
    "Zoho": "PARTIAL",
    "QuickBooks": "PARTIAL",
    "Evidence_Level": "DOC",
    "Evidence_URLs": "https://unece.org/trade/documents/2021/06/uncefact-rec20-0",
    "Notes_for_Migration/Extensibility": "You need this before robust inventory/PO/sales quantity math."
  },
  {
    "Domain": "MAT",
    "Config_Set": "MAT_UOM_CONVERSION",
    "Priority": "P0",
    "Scope": "TENANT",
    "Purpose": "Conversions within categories and packaging conversions.",
    "Minimum_Requirements_(P0)": "Factor; rounding; direction; item-specific overrides; validation.",
    "Key_Attributes_(suggested)": "from_uom, to_uom, factor, rounding, item_override",
    "Standards/Reference": "UNECE context",
    "Recommended_Data_Model": "Rules",
    "Effective-Dated?": "Yes",
    "Typical_Values_Count_(P0)": "100-100000",
    "SAP_S4HANA": "PASS",
    "Oracle_NetSuite": "PASS",
    "MS_Dynamics_365": "PASS",
    "Odoo": "PASS",
    "Zoho": "PARTIAL",
    "QuickBooks": "PARTIAL",
    "Evidence_Level": "INFERRED",
    "Evidence_URLs": "",
    "Notes_for_Migration/Extensibility": "Separate physical conversions from item packaging conversions."
  },
  {
    "Domain": "MAT",
    "Config_Set": "MAT_PRODUCT_DIMENSION_DEF",
    "Priority": "P1",
    "Scope": "TENANT",
    "Purpose": "Variant dimensions (size/color/style/batch attributes).",
    "Minimum_Requirements_(P0)": "Dimension definitions; affects SKU; allowed values; hierarchy.",
    "Key_Attributes_(suggested)": "dim_code, type, affects_sku, allowed_values, hierarchy",
    "Standards/Reference": "Industry practice",
    "Recommended_Data_Model": "Meta + value-sets",
    "Effective-Dated?": "Yes",
    "Typical_Values_Count_(P0)": "10-200",
    "SAP_S4HANA": "PASS",
    "Oracle_NetSuite": "PASS",
    "MS_Dynamics_365": "PASS",
    "Odoo": "PASS",
    "Zoho": "PARTIAL",
    "QuickBooks": "WEAK",
    "Evidence_Level": "INFERRED",
    "Evidence_URLs": "",
    "Notes_for_Migration/Extensibility": "Critical for retail/manufacturing migrations."
  },
  {
    "Domain": "MAT",
    "Config_Set": "MAT_ROUNDING_RULE",
    "Priority": "P1",
    "Scope": "TENANT",
    "Purpose": "Rounding rules for quantities (min order qty, pack size, etc.).",
    "Minimum_Requirements_(P0)": "Rounding increments; enforcement mode; per item/category overrides.",
    "Key_Attributes_(suggested)": "rule_code, increment, mode, applies_to",
    "Standards/Reference": "Industry practice",
    "Recommended_Data_Model": "Rules",
    "Effective-Dated?": "Yes",
    "Typical_Values_Count_(P0)": "10-10000",
    "SAP_S4HANA": "PASS",
    "Oracle_NetSuite": "PASS",
    "MS_Dynamics_365": "PASS",
    "Odoo": "PARTIAL",
    "Zoho": "WEAK",
    "QuickBooks": "WEAK",
    "Evidence_Level": "INFERRED",
    "Evidence_URLs": "",
    "Notes_for_Migration/Extensibility": "Helps match legacy behavior during migration."
  }
]