[
  {
    "Domain": "TIME",
    "Config_Set": "TIME_ACCOUNTING_PERIOD",
    "Priority": "P0",
    "Scope": "LEGAL_ENTITY",
    "Purpose": "Generated periods for fiscal calendar.",
    "Minimum_Requirements_(P0)": "Period list; start/end dates; rollups (year/quarter/month/week).",
    "Key_Attributes_(suggested)": "period_id, calendar_ref, start, end, rollup_refs",
    "Standards/Reference": "Accounting practice",
    "Recommended_Data_Model": "Entity",
    "Effective-Dated?": "Yes",
    "Typical_Values_Count_(P0)": "12-5000",
    "SAP_S4HANA": "PASS",
    "Oracle_NetSuite": "PASS",
    "MS_Dynamics_365": "PASS",
    "Odoo": "PARTIAL",
    "Zoho": "WEAK",
    "QuickBooks": "WEAK",
    "Evidence_Level": "INFERRED",
    "Evidence_URLs": "",
    "Notes_for_Migration/Extensibility": "Make periods explicit so period close and reporting are deterministic."
  },
  {
    "Domain": "TIME",
    "Config_Set": "TIME_FISCAL_CALENDAR",
    "Priority": "P0",
    "Scope": "LEGAL_ENTITY",
    "Purpose": "Fiscal year/period model (Gregorian, 4-4-5 etc.).",
    "Minimum_Requirements_(P0)": "Fiscal year start; period rules; quarter mapping; multi-calendar support.",
    "Key_Attributes_(suggested)": "calendar_code, type, start_month, period_rules, mapping",
    "Standards/Reference": "Accounting practice",
    "Recommended_Data_Model": "Entity + generated periods",
    "Effective-Dated?": "Yes",
    "Typical_Values_Count_(P0)": "1-100",
    "SAP_S4HANA": "PASS",
    "Oracle_NetSuite": "PASS",
    "MS_Dynamics_365": "PASS",
    "Odoo": "PARTIAL",
    "Zoho": "WEAK",
    "QuickBooks": "WEAK",
    "Evidence_Level": "DOC",
    "Evidence_URLs": "https://docs.oracle.com/en/cloud/saas/netsuite/ns-online-help/section_N1445585.html",
    "Notes_for_Migration/Extensibility": "NetSuite accounting period setup is a useful benchmark."
  },
  {
    "Domain": "TIME",
    "Config_Set": "TIME_LOCALE",
    "Priority": "P0",
    "Scope": "TENANT",
    "Purpose": "Locale tags (formatting, language-region).",
    "Minimum_Requirements_(P0)": "BCP-47 tags; defaults and fallbacks.",
    "Key_Attributes_(suggested)": "locale_tag, language, region, fallback",
    "Standards/Reference": "BCP 47 / RFC 5646",
    "Recommended_Data_Model": "Value-set",
    "Effective-Dated?": "No",
    "Typical_Values_Count_(P0)": "5-50",
    "SAP_S4HANA": "PASS",
    "Oracle_NetSuite": "PASS",
    "MS_Dynamics_365": "PASS",
    "Odoo": "PASS",
    "Zoho": "PASS",
    "QuickBooks": "PASS",
    "Evidence_Level": "DOC",
    "Evidence_URLs": "https://datatracker.ietf.org/doc/html/rfc5646",
    "Notes_for_Migration/Extensibility": "Separate locale from translation strings."
  },
  {
    "Domain": "TIME",
    "Config_Set": "TIME_PERIOD_CONTROL",
    "Priority": "P0",
    "Scope": "LEGAL_ENTITY",
    "Purpose": "Open/close/lock rules per module per period.",
    "Minimum_Requirements_(P0)": "Status per module; lock date; close checklists; exception handling.",
    "Key_Attributes_(suggested)": "period_ref, module, status, lock_date, checklist_ref",
    "Standards/Reference": "Period close practice",
    "Recommended_Data_Model": "Entity",
    "Effective-Dated?": "Yes",
    "Typical_Values_Count_(P0)": "12-50000",
    "SAP_S4HANA": "PASS",
    "Oracle_NetSuite": "PASS",
    "MS_Dynamics_365": "PASS",
    "Odoo": "PARTIAL",
    "Zoho": "WEAK",
    "QuickBooks": "WEAK",
    "Evidence_Level": "INFERRED",
    "Evidence_URLs": "",
    "Notes_for_Migration/Extensibility": "Kernel-owned to enforce consistency across all canons."
  },
  {
    "Domain": "TIME",
    "Config_Set": "TIME_TIMEZONE",
    "Priority": "P0",
    "Scope": "TENANT",
    "Purpose": "Timezone master list used by system and sites.",
    "Minimum_Requirements_(P0)": "Use IANA tzids; allow tzdb updates; store canonical tzid.",
    "Key_Attributes_(suggested)": "tzid, display_name, status",
    "Standards/Reference": "IANA TZDB",
    "Recommended_Data_Model": "Value-set",
    "Effective-Dated?": "No",
    "Typical_Values_Count_(P0)": "20-200",
    "SAP_S4HANA": "PASS",
    "Oracle_NetSuite": "PASS",
    "MS_Dynamics_365": "PASS",
    "Odoo": "PASS",
    "Zoho": "PASS",
    "QuickBooks": "PASS",
    "Evidence_Level": "DOC",
    "Evidence_URLs": "https://www.iana.org/time-zones",
    "Notes_for_Migration/Extensibility": "Never store only GMT offsets; DST breaks it."
  },
  {
    "Domain": "TIME",
    "Config_Set": "TIME_DATE_TIME_FORMAT_PROFILE",
    "Priority": "P1",
    "Scope": "TENANT",
    "Purpose": "Date/time/number format profiles for UI + documents.",
    "Minimum_Requirements_(P0)": "Patterns; separators; currency formatting by locale.",
    "Key_Attributes_(suggested)": "format_code, date_pattern, time_pattern, number_pattern, currency_pattern",
    "Standards/Reference": "ISO 8601 for interchange",
    "Recommended_Data_Model": "Value-set",
    "Effective-Dated?": "Yes",
    "Typical_Values_Count_(P0)": "5-50",
    "SAP_S4HANA": "PASS",
    "Oracle_NetSuite": "PASS",
    "MS_Dynamics_365": "PASS",
    "Odoo": "PASS",
    "Zoho": "PASS",
    "QuickBooks": "PARTIAL",
    "Evidence_Level": "DOC",
    "Evidence_URLs": "https://www.iso.org/iso-8601-date-and-time-format.html",
    "Notes_for_Migration/Extensibility": "Store ISO 8601 in APIs/storage; format profiles for display only."
  },
  {
    "Domain": "TIME",
    "Config_Set": "TIME_HOLIDAY_CALENDAR",
    "Priority": "P1",
    "Scope": "TENANT",
    "Purpose": "Holiday calendars by region/site.",
    "Minimum_Requirements_(P0)": "Holiday dates; recurrence; observance rules; exceptions.",
    "Key_Attributes_(suggested)": "calendar_code, date, name, recurrence, observance_rule",
    "Standards/Reference": "Jurisdictional holiday data (varies)",
    "Recommended_Data_Model": "Entity",
    "Effective-Dated?": "Yes",
    "Typical_Values_Count_(P0)": "10-5000",
    "SAP_S4HANA": "PASS",
    "Oracle_NetSuite": "PASS",
    "MS_Dynamics_365": "PASS",
    "Odoo": "PASS",
    "Zoho": "PARTIAL",
    "QuickBooks": "WEAK",
    "Evidence_Level": "INFERRED",
    "Evidence_URLs": "",
    "Notes_for_Migration/Extensibility": "Keep data-source pluggable; holidays change."
  },
  {
    "Domain": "TIME",
    "Config_Set": "TIME_WORKING_DAY_CALENDAR",
    "Priority": "P1",
    "Scope": "TENANT",
    "Purpose": "Working days/shifts for SLAs, lead times, approvals.",
    "Minimum_Requirements_(P0)": "Weekday rules; shifts; per-site overrides; effective dating.",
    "Key_Attributes_(suggested)": "calendar_code, weekdays, shifts, site_overrides, effective_from/to",
    "Standards/Reference": "Ops practice",
    "Recommended_Data_Model": "Entity",
    "Effective-Dated?": "Yes",
    "Typical_Values_Count_(P0)": "1-500",
    "SAP_S4HANA": "PASS",
    "Oracle_NetSuite": "PASS",
    "MS_Dynamics_365": "PASS",
    "Odoo": "PASS",
    "Zoho": "PARTIAL",
    "QuickBooks": "WEAK",
    "Evidence_Level": "INFERRED",
    "Evidence_URLs": "",
    "Notes_for_Migration/Extensibility": "Needed for manufacturing/service scheduling and accurate lead times."
  }
]